{"contract":"helianthus.platform.draft-candidate-fact-replay.v1","graph_hash":"sha256:00f2b3c48959605d311d0d3895ec924b475d8fa25ee4e236d32d6facbd32c4ac","graph_id":"dcfgv1:sha256:00f2b3c48959605d311d0d3895ec924b475d8fa25ee4e236d32d6facbd32c4ac","registry_digest":"sha256:e6895b8d7406b58ed97599d8da7e9bd3b252e6e7ca3b0578ec6385bfe6dfe1c0","replay_hash":"sha256:0d3d6c1b4d23e1a8dfe6137fd7956f2c0c3fa51009c1ebb9129807c9fd49850b","replay_id":"dcfrv1:sha256:0d3d6c1b4d23e1a8dfe6137fd7956f2c0c3fa51009c1ebb9129807c9fd49850b","results":[{"candidate_id":"m7-candidate-0001","comparator_outcome":"NOT_EVALUATED","confidence":{"basis":"INSUFFICIENT","level":"LOW","score_milli":100},"fact_hash":"sha256:7b57568f49337c947c799c7009d85db9e2a7e47c8e66a2a0f34dce1012e2e0fe","native_evidence_digests":["sha256:6666666666666666666666666666666666666666666666666666666666666666"],"proposed_path":"/candidates/cloud_only/room_temperature","status":"WITHHELD","terminal_negative_state":"CLOUD_ONLY"},{"candidate_id":"m7-candidate-0002","comparator_outcome":"NOT_EVALUATED","confidence":{"basis":"OBSERVED","level":"LOW","score_milli":200},"fact_hash":"sha256:23078a3e3bbbc950919c184705c60d837e20fc588e2a09eccde4a444890e4860","native_evidence_digests":["sha256:3333333333333333333333333333333333333333333333333333333333333333"],"proposed_path":"/candidates/ebus/b524_raw","status":"RAW_ONLY","terminal_negative_state":null},{"candidate_id":"m7-candidate-0003","comparator_outcome":"NOT_EVALUATED","confidence":{"basis":"INFERRED","level":"LOW","score_milli":300},"fact_hash":"sha256:869e0ebd4ca1df17f3bad602e5c8255c37d0cbf1d54ec4739fec9bc8f1170210","native_evidence_digests":["sha256:2222222222222222222222222222222222222222222222222222222222222222","sha256:5555555555555555555555555555555555555555555555555555555555555555"],"proposed_path":"/candidates/eebus/service_anchor","status":"RAW_ONLY","terminal_negative_state":null},{"candidate_id":"m7-candidate-0004","comparator_outcome":"NOT_EVALUATED","confidence":{"basis":"INSUFFICIENT","level":"LOW","score_milli":0},"fact_hash":"sha256:420af2ca4ed9e190a3685a66893149211776290d23552fed430587517f914c85","native_evidence_digests":["sha256:2222222222222222222222222222222222222222222222222222222222222222"],"proposed_path":"/candidates/no_signal/room_temperature","status":"WITHHELD","terminal_negative_state":"NO_SIGNAL"},{"candidate_id":"m7-candidate-0005","comparator_outcome":"NOT_EVALUATED","confidence":{"basis":"INSUFFICIENT","level":"LOW","score_milli":0},"fact_hash":"sha256:f329ddd7230ae6447b0d8931f7fa04dc3079f4383f23f59606dc7c4f473c33f0","native_evidence_digests":["sha256:1111111111111111111111111111111111111111111111111111111111111111"],"proposed_path":"/candidates/not_tested/schedule","status":"WITHHELD","terminal_negative_state":"NOT_TESTED"},{"candidate_id":"m7-candidate-0006","comparator_outcome":"NOT_EVALUATED","confidence":{"basis":"OBSERVED","level":"MEDIUM","score_milli":700},"fact_hash":"sha256:38799403b30146541148faffc292122b2512fd11ac1b950557e56e620c39791a","native_evidence_digests":["sha256:3333333333333333333333333333333333333333333333333333333333333333"],"proposed_path":"/candidates/zones/zone_1/room_temperature","status":"WITHHELD","terminal_negative_state":"NOT_TESTED"},{"candidate_id":"m7-candidate-0007","comparator_outcome":"NOT_EVALUATED","confidence":{"basis":"OBSERVED","level":"MEDIUM","score_milli":500},"fact_hash":"sha256:42244f6d48e1e10dae3347692da86777aba997ea72cdf02c243e777a26c38294","native_evidence_digests":["sha256:4444444444444444444444444444444444444444444444444444444444444444"],"proposed_path":"/candidates/zones/zone_1/schedule_start","status":"RAW_ONLY","terminal_negative_state":null}],"schema_version":1,"source_bundle":{"bundle_hash":"sha256:2df0e688d8c615c657698350eac545a5997af39d50502dc56fe2df5eade5da61","bundle_id":"sebv1:sha256:2df0e688d8c615c657698350eac545a5997af39d50502dc56fe2df5eade5da61","replay_hash":"sha256:d67fbf596558b994a42ed93e7436a340c22d34d93e4db6f2bf442a48a7f82a4f"}}
